{"schema_version":"2.0.0","election_year":2012,"election_type":"presidential","unit":"election","source_id":"ine_counted_lists","rate_unit":"proportion","data":[{"election_year":2012,"LN":76490962,"SV":47383154,"NV":28939159,"NS":168649,"source_row_count":8604456,"sex_2_source_rows":0,"sex_2_nominal_count":0,"specified_count":76322313,"participation_observed":0.6208296386405375,"nonparticipation_observed":0.37917036135946247,"participation_nominal":0.6194608194364192,"unspecified_rate":0.0022048225776007367,"is_observed_undefined":false,"is_nominal_undefined":false,"has_low_registered_count":false,"has_low_specified_count":false,"has_few_source_rows":false,"has_low_support":false,"has_high_ns":false,"election_type":"presidential"}],"warnings":["Son segmentos agregados, no personas ni clases naturales descubiertas.","NS representa no especificación, no abstención. Las tasas no definidas son NULL.","Las claves territoriales se consultan dentro de cada elección; no hay equivalencias municipales históricas oficiales validadas.","U/R/M describe secciones electorales, no residencia individual ni localidad.","La lista nominal reportada procede de cuadernillos; no incluye casillas especiales ni voto del extranjero según el diccionario.","Los municipios pueden pertenecer a varios perfiles; su cobertura no se suma entre perfiles.","Los intervalos y el signo relativo son reglas explícitas. Una diferencia cercana a cero requiere cautela."]}